23:00:20.958339 IP 81.224.142.68.12185 > 192.168.2.106.61107: Flags [P.], seq 3509285065:3509285100, ack 1335245019, win 253, options [nop,nop,TS val 32625325 ecr 92615198], length 35
23:00:20.958460 IP 192.168.2.106.61107 > 81.224.142.68.12185: Flags [.], ack 35, win 33102, options [nop,nop,TS val 92615207 ecr 32625325], length 0
23:00:21.469846 IP 91.154.103.41.49379 > 192.168.2.106.61273: Flags [P.], seq 4236048666:4236048701, ack 1814386258, win 65134, options [nop,nop,TS val 485378 ecr 92615014], length 35
23:00:21.469959 IP 192.168.2.106.61273 > 91.154.103.41.49379: Flags [.], ack 35, win 33102, options [nop,nop,TS val 92615212 ecr 485378], length 0
23:00:21.777662 IP 81.224.142.68.12185 > 192.168.2.106.61107: Flags [P.], seq 35:70, ack 1, win 253, options [nop,nop,TS val 32625412 ecr 92615207], length 35
23:00:21.777744 IP 192.168.2.106.61107 > 81.224.142.68.12185: Flags [.], ack 70, win 33102, options [nop,nop,TS val 92615215 ecr 32625412], length 0
23:00:21.919131 IP 192.168.2.106.17500 > 255.255.255.255.17500: UDP, length 109
23:00:21.919983 IP 192.168.2.106.17500 > 192.168.2.255.17500: UDP, length 109
23:00:21.929874 IP 91.157.32.252.28359 > 192.168.2.106.61272: Flags [P.], seq 587865955:587865990, ack 4119050703, win 65535, options [nop,nop,TS val 30986904 ecr 92615188], length 35
23:00:21.929957 IP 192.168.2.106.61272 > 91.157.32.252.28359: Flags [.], ack 35, win 33102, options [nop,nop,TS val 92615217 ecr 30986904], length 0
23:00:21.963756 IP 91.157.32.252.28359 > 192.168.2.106.61272: Flags [P.], seq 35:70, ack 1, win 65535, options [nop,nop,TS val 30986905 ecr 92615217], length 35
23:00:21.963860 IP 192.168.2.106.61272 > 91.157.32.252.28359: Flags [.], ack 70, win 33102, options [nop,nop,TS val 92615217 ecr 30986905], length 0